{"schemaVersion":"moonshot-kimi-k3-token-estimate-evidence.v2","evidenceId":"mk3tee_kimi_k3_v7_final_20260801_001","provider":"moonshot","model":"kimi-k3","baseURL":"https://api.moonshot.ai/v1","endpoint":"/tokenizers/estimate-token-count","source":{"runtimeCommit":"4172a6036e86780cfa5e1f34ce5dcd8dc8c05321","sourceCommit":"3321fd054e22e01e7b34a0a23c655db521eccf7b","sourceTree":"7b9fb46f944569b3bcb1871adca8f5229787c9dd"},"bindings":{"formalRequestSha256":"sha256:7bf1906b3c6583bb9fa73ac2a5d3d8d6ea8d0a43522e68cd6435c6ea4713d31c","messagesSha256":"sha256:cafca82c19cd22dccaf96a32a616ef3a1a0eed49b9f7f2adc5f7b337317971c9","reviewMaterialSha256":"sha256:e461a9eb28a682af9b9930f383c774e1c05768d2c107c7540e02320f263844b1","reviewBundleSha256":"sha256:3426ca9a7b42f7508193491b52e9f2adc5e14c5a05f2d529dace4f8c252f92f1","configSha256":"sha256:96441702332a988bc528e1cde6d70123150a3d64189857b9bca44bd5ca83c4af","configSchemaSha256":"sha256:8ec88713465621408a8fb2677b2847b7bc5a4f27c3f15d440e2d10318191379f","outputSchemaSha256":"sha256:27fa9391a7f8df16f5b6302d9bd3d3f4d076157133549a992b406d917330c566","nonMessageVisibleInputSha256":"sha256:e84a8499709c1411bd27d60edc62a4aa00975a0759385dd6b959b812d697d17a","nonMessageVisibleInputByteLength":1352,"requestSchemaCoverage":"EXACT_MESSAGES_PLUS_FIXED_NON_MESSAGE_RESERVE"},"formalRequest":{"path":"request.json","encoding":"UTF-8","byteLength":1924399,"sha256":"sha256:7bf1906b3c6583bb9fa73ac2a5d3d8d6ea8d0a43522e68cd6435c6ea4713d31c"},"request":{"path":"token-estimate-request.json","encoding":"UTF-8","byteLength":1923066,"sha256":"sha256:0d022667417c9897c29bde84421c041b775e32c58bac0e01ed940ca18a2a3b51"},"response":{"path":"token-estimate-response.json","encoding":"UTF-8","byteLength":69,"sha256":"sha256:2534e2b372e4d5fa04344e69d940ead9177b15abea4be721fc8c2fd4785015dd","httpStatus":200,"contentType":"application/json; charset=utf-8"},"estimate":{"estimatedMessageInputTokens":459878,"contextWindowTokens":1048576,"nonMessageVisibleTokenReserve":65536,"maxCompletionTokens":32768,"safetyMarginTokens":8192,"requiredContextTokens":566374,"coverage":"EXACT_MESSAGES_PLUS_FIXED_NON_MESSAGE_RESERVE","contextProved":true},"budget":{"currency":"USD","taxBasis":"TAX_EXCLUSIVE","budgetMicros":4000000,"cacheMissInputPriceMicrosPerMillion":3000000,"outputPriceMicrosPerMillion":15000000,"worstCaseBillableInputTokens":525414,"worstCaseInputMicros":1576242,"worstCaseOutputMicros":491520,"worstCaseTotalMicros":2067762,"budgetProved":true},"networkAttemptCount":1,"startedAt":"2026-08-01T23:16:38.946Z","finishedAt":"2026-08-01T23:16:42.043Z","evidenceSha256":"sha256:b033e701aec302d10d79e2a8482ac637d1aac3fb0120c87f19919dd52e827fa7"}